,질문 날짜,질문,내용,답변
0,2024-08-30,미생물 음쓰처리기,미생물 음쓰 처리기는 매운음식이랑 물기가 있는 음식은 들어가면 안된다던데 왜 그런건가요?,"['미생물 음쓰 처리기는 주로 미생물의 분해 작용을 통해 음식물 쓰레기를 처리하는 장치입니다. 매운 음식은 고추나 향신료가 포함되어 있어 미생물의 활동에 영향을 줄 수 있습니다. 이러한 성분들이 미생물의 생장이나 분해 효율을 저하시킬 수 있기 때문입니다.또한, 물기가 있는 음식은 수분 함량이 높아 부패를 촉진할 수 있고, 미생물의 활동을 방해할 수 있습니다. 과도한 수분은 처리 과정에서 불균형을 초래할 수 있어, 최적의 분해 환경을 유지하기 어렵게 만듭니다. 따라서 매운 음식과 물기가 많은 음식은 피하는 것이 좋습니다.']"
1,2022-04-13,음쓰처리기 편해요?,음쓰버리러 나가는일도 정말 귀찮네요.. 저희 집은 아파트이고 싱크대 밑에 음쓰처리기 설치를 하고 싶어요   혹시 음쓰 처리기 사용 중이 신분 있나요? 편리한지 너무 궁금해요 음쓰 처리기가 분쇄 방식이랑 미생물 방식도 있고 어떤 게 좋은 건지 모르겠어요 음쓰 처리기 사용자분들의 추천받습니다!,"['음쓰처리기 알아보시나봅니다.음쓰처리기중에서 분쇄기의 경우음식물들을 처리하는데는 빠르고 효과적이지만불법제품이 많아 사용시 문제가 될 수 있으며환경오염에도 영향을 미칩니다.또한 소음도 크기때문에 이점 참고하시면 좋구요음쓰처리기중에 만힝 선호하는게미생물 방식입니다.음식물들을 미생물로 소멸하는방식으로처리하는데에 다소 시간이 걸릴수있으나하루면 거의다 소멸되므로 쓰는데 지장이 없고합법적인 제품으로 환경에도 좋습니다.특히 아파트에 거주중이시라면 음식물처리기에대해 잘 알아보시고 구매하시길 바랍니다.', '저희 집에서 사용 중인음쓰 처리기 추천드릴게요일단 불법 아닌 합법 제품이고요분쇄 방식이 아닌 미생물로 음식물을소멸하는 방식이기 때문에소음도 없고 물론 냄새도 나지 않습니다.타마 음식물 처리기는싱크대 설치형 제품이고요그리고 A/S도 확실한 제품이기 때문에마음 편하게 사용이 가능하다는 점과전기세 또한 걱정하지 않으셔도 됩니다.한 달 전기 요금은 800원 정도로정말 걱정 없이 사용할 수 있고요또 무엇보다 중요한 건음식물들을 처리해 줄 바로 미생물인데요잘 모르시는 것 같아 설명드리겠습니다.음식물을 처리기 안에 넣으면미생물이 음식물들을 분해해100% 액상 배출을 해주는 방식인데요그렇기 때문에분쇄기와는 달리 하수구가 막히는 일이 없고환경에도 아주 좋습니다.미생물은 보통 1년에 한 번 정도 갈아주면 되고요1.5kg까지 음식물 처리가 가능합니다.그리고 분쇄기 제품 같은 경우는 환경에 안 좋고하수구 막히는 일이 발생할 수 있어불법 제품이라고 뉴스에 나오더라고요..그래서 저는 개인적으로 소멸 방식인타마 음식물 처리기를 추천드려요']"
2,2024-06-05,음쓰처리기 탈취 제대로인 것 찾는다면 마이니모,"안녕하세요. 결혼 후에 가전 준비할 때 미처 생각하지 못한 게 바로 음쓰처리기에요. 필수 가전에는 없어서 구매하지 못했는데 살다보니 너무 필요한 것 있죠. 거기다가 날이 더워지니까 음쓰에서 냄새도 나고, 곰팡이도 금방 생겨서 위생적으로 안 좋겠다 싶었어요. 그래서 이번에 음쓰처리기를 사려고 하는데요. 요즘에 많이 사용하는 제품이 무엇이 있을까요? 냄새도 잡아 주면서 빠르게 음쓰 처리되는 것을 사고 싶어요.","['안녕하세요. 저는 음쓰처리기로 마이니모를 추천합니다.여러 가지 장점이 있는 음쓰처리기인데요.일단 미생물제제가 특허를 받았어요.음식물 쓰레기를 화학적인 방법으로 없애는 게 아니라자연스럽게 미생물이 분해해서 악취도 없고, 또 그 과정에서대기 건강도 지킬 수 있어요.거기다가 이 음쓰처리기는 4중의 하이브리드 탈취 시스템을 갖췄어요.99.9%의 세균과 악취를 제거해서 쾌적하게 사용할 수 있습니다.그리고 일부 소음을 걱정하시는데,이 음쓰처리기는 저소음의 프리미엄 모터를 사용해서가정에서 사용해도 소음 걱정 덜 수 있어요.또 빠르게 처리하는 걸 원하신다 하셨는데,이 제품은 24시간 안으로 처리가 되어서 초고속에 가까워요.하루 안에 음식물 쓰레기를 처리할 수 있으니 편하고, 깔끔합니다.거기다고 고온과 UV-C 살균도 가능해요.유해균을 제거해서 위생적으로도 좋아요.여러 모로 고민했을 때 기능적으로 이 음쓰 처리기 추천합니다. ', '안녕하세요! 문의하신 질문에 대한 답변입니다.작성하신 내용을 살펴보았는데요.저도 음쓰때문에 고민이 이만저만 아니었어요냉동실에도 넣어봤는데.. 그거 정말 안좋다고해서귀찮아도 바로바로 버리고 그랬어요~ 올스텐으로된 음쓰 쓰레기통도 비싼 돈 주고사봤구요 ㅎㅎㅎ  근데 마찬가지였죠... ;;;;그리고 음식물처리기는 공간을 차지해서 저는 아예 싱크대에서 분쇄하는걸 했는데요~ 정말 혼수에서 제일 잘 했다고 하는 두가지 중하나에요~!  하나는 건조기고 ㅎㅎ 제가 설치한 음식물처리기는 싱크케어에요.싱크케어 설치하고 정말 너무 편해졌어요!바로바로 갈아서 없애주니까 세상 너무 편한거 있죠!이거 없었으면 평생 요리하기 싫었을 수도 있겠다는생각을 했을 정도에요 ^^  특히나 지금처럼 더운여름에는 더더욱이요~!  렌트도 가능하니 저렴하게삶의 질을 향상시켜보세요! 정말 후회 없으실거에요! - 환경부 공식 판매 인증 및 디자인 특허 제품- 30dB 이하 저소음 작동- 천연 미생물로 100% 액체 배출- 단 25초면 끝나는 간편 처리- 장시간 외출 시 자동 외출 모드- 15년의 노하우로 특허권 10종 및 각종 인증서 14종 보유- 허머의 기술력과 현대렌탈의 케어 시스템- 주기적인 안심 관리 서비스- 현대렌탈케어 전문 엔지니어가 직접 방문 설치무료상담하러가기 https://me2.kr/G5qNf싱크케어 렌탈은 제휴 카드로 월 6,900원에 이용 가능해요!가격 부담도 없고, 생활의 질이 급상승하는 효과를 느껴보세요!6,900원으로 삶의 질이 올라가는 기회를 놓치지 마세요. ^^ 질문자님에게 답변이 도움이 되셨길 바라며~! 음식물 찌거기 고민 해결하고 더 나은 삶을 누리시길 바랍니다. ^^일부 수수료를 받을 수 있습니다.']"
3,2022-12-23,음쓰 처리기 질문,티비에서 음쓰 처리기를 봤는데 음식물을 흙처럼 만들어 주는 걸 보고 궁금해서 찾아봤는데 미생물을 이용한다고 나와있더라고요.근데 음쓰 처리기에 사용되는 미생물 종류가 뭔가요?,"[""음식물처리기(음쓰처리기) 중에서는 음식물을 흙처럼 만들어주는 종류가 있습니다. 이런 유형의 음식물 처리기는 주로 미생물 발효 공정을 이용하며, 이때 사용되는 미생물은 보통 '발효균'이라고 일컬어지는, 여러 가지 종류의 균류와 배양물을 활용합니다.아래에 이러한 균들의 일부를 소개하겠습니다:1. 락토바실러스균(Lactobacillus): 요구르트 제조 공정에서 주로 사용되는 이 균은 우리 주변 환경에 널리 분포해 있으며, 유산균으로도 알려져 있습니다. 발효과정에서 이 균은 유기물을 분해하고, 나쁜 냄새를 제거해줍니다.2. 아세트산균(Acetobacter): 이 균은 알코올을 아세트산(식초)으로 변환하는 과정에서 활용되며, 음식물 발효에서도 중요한 역할을 합니다.3. 효모균(Yeast): 효모는 특히 빵이나 맥주 등을 만드는 데 사용되며, 발효 과정에서 중요한 역할을 합니다.4. 바실러스균(Bacillus): 이 균은 각종 발효 공정에서 널리 사용되며, 특히 나트토, 치즈, 요구르트 등의 제조에 활용됩니다.위의 균들은 모두 발효 공정에서 중요한 역할을 합니다. 이들은 음식물을 분해하고, 유해한 물질을 중화하며, 풍부한 흙을 생성하는 데 도움을 줍니다. 그러나 음식물 처리기를 사용할 때는 항상 사용법을 잘 따르는 것이 중요합니다※ ※ ※ ※ ※ ※추가로 음식물처리기 설치를 생각중이시거나미생물 분해방식인 음식물처리기를 고르시게 된다면 타마 스톰 이라는 음식물처리기를 추천드릴 수 있습니다.음식물처리기  종류도 여러개인데미생물이 소음도 적은편이고 친환경적이라 괜찮습니다.그리고 씽크대에 설치형이라 붓기만하면 알아서 미생물들이분해를 해줘 매우 편하기도하지요음식물은 최대 1.5kg 까지 담을 수 있으며씽크대하부장에 설치가 되서안에서 알아서 돌리고 물도 뿌리고미생물 넣어논게 분해해가지고음식물들을 없애주는거라냄새도 없고 시끄럽지도 않고 괜찮습니다.답변이 도움되셨다면 채택 부탁드립니다."", '음쓰처리기 번거로워요 미생물 보관힘들어요 편하자고 한건데 은근 신경쓰임']"
4,2022-06-19,미생물 음식처리기 전기세,열풍건조 분쇄식은 예를들어 휴렉같이 음쓰를 기계에 넣어 열로 건조시킬때에 최대의 에너지가 발생한다고 생각되는데  미생물 음식물처리기는 평소에는 60w 가 대부분이더라구요 최대치는 362 w/h 구요  그럼 음식을 넣으면 60w의 전기가 소모되고 탈취나 제습 버튼을 누르면 그때 최대치 362w/h까지 올라간다는 이아기 인가요? 너무 궁금합니다  미생물 음쓰 기계들은 대부분 내부온도가 40~60도를 자체적으로 유지하나요?,"['60W는 소비전력이고요 362Wh 는 한시간 사용하면 소비되는 전력이  362W한다는 의미입니다 그런데 계산이 안 맞아요60W를 한시간 사용하면 60Wh가 되어야 합니다362Wh는 60W를 6시간 사용한 양입니다 온도에 대해서는 제품 사양이라서 알 수 없네요', '60W를 한시간 사용하면 60Wh가 되어야 합니다', '온도는 제품마다 사양에 따라서 다르고..60W를 한시간 사용할 경우 60Wh가 되어야 정상입니다.', '362Wh 는 한시간 사용하면 소비되는 전력이  362W한다는 의미입니다그런데 계산이 안 맞아요362Wh는 60W를 6시간 사용한 양입니다', '60w 한시간 사용하면 60w/h']"
