,질문 날짜,질문,내용,답변
164,2024-04-22,음식물 분쇄기 관련해서..,"안녕하세요 음식물 분쇄기 사용해도 괜찮을까요? 사용하면 위법이라고해서 안전할지 궁금해요  음식물 분쇄기 불법이라고 쓰지말라고하더라구요 그래서 제가 정말 궁금해서 지식인에 질문드렸어요. 다른것도 찾아봤는데 음식물 분쇄기가 마음에 들었는데요, 집에 설치하려는데 불법이라고해서 마음에 걸리네요 ㅠㅠ  그래서 미생물 음식물처리기도 고민하고있는데요 음식물분쇄기중 합법적으로 설치할수있는게 있나요?  고민하고있는데  싱크퓨어 (분쇄형) vs 웰싱 (미생물형)","[""안녕하세요.음식물처리기 전문가 '음쓰왕'입니다.음식물 분쇄기 불법인지 궁금하신 상황이시군요.결론부터 말씀드립니다.불법인게 있고, 합법인게 있습니다.다만, 합법으로 싱크대 음식물 분쇄기를 사용하면 남은 찌꺼기의 80%를 소비자가 직접 걸러줘야 하기 때문에 사용하니만 못합니다.대부분의 전문가들의 의견은 동일할텐데, 저 역시 '굳이 불법 위험을 감수하고까지 구매할 필요가 없다'는 말씀을 드리고 싶습니다.왜냐하면 언급하신 미생물 음식물처리기도 분쇄형 못지 않게 기능이 좋아졌기 때문입니다.남겨주신 웰싱 제품은 대표가 직접 운영하는 블로그가 있습니다. 접속해서 내용을 보시면 궁금해하시는 내용이 모두 나와 있습니다.* 음식물처리기 이미 산 사람? 절대 클릭 금지 *http://m.post.naver.com/viewer/postView.naver?volumeNo=35622628&memberNo=41874661질문자님의 고민에 도움이 되었길 바라며,혹시 풀리지 않은 궁금증이 있으시다면 댓글로 언제든 남겨주시길 바랍니다.  "", '음식물분쇄기 분쇄형과 미생물형 고민하는 사람들이 많이 있습니다.두가지의 장단점이 존재하지만 내가 쓰기에 편한건 무엇일지 찾아서  고르는게 좋습니다.저같은 경우는 미생물은 미생물을 키우는것이 귀찮고 여행이나 멀리나가있을때미생물 관리도 않되고 요리를 잘 안하는 스타일이라 음식물이 많이 나오지 않아 오히려 힘들었습니다.혼자 사는 사람에겐 미생물형이 안좋을 수 있어요. 그런점 감안해서 음식물분쇄기 알아보세요.']"
165,2024-08-10,음식물 쓰레기 벌레 생기는데,여름되니까 구더기가 생겼더라고요  벌레 안생기게 하려면 어떻게 해야 할까요?  음식물쓰레기 처리기는 비싸기도 하고 못미더워서 안사려구요,"['음식물 쓰레기에 벌레가 생기지 않으려면 다음과 같은 방법을 시도해 보세요. 1) 자주 배출하고, 2) 밀폐된 용기에 담아 보관하며, 3) 냉장고에 넣어 부패를 늦추세요. 4) 쓰레기통과 주변을 깨끗이 유지하고, 5) 식초나 레몬 껍질을 사용하여 천연 방충제를 활용하세요.', '집안에 보이는 파리 초파리등 다 제거해주시고요음식물 쓰레기 자주 버려주시는게최선입니다', '자주버리셔야 합니다. 다른 방법 없어요', '저는 음식물쓰레기 냉장고 구매했는데 음식물 쓰레기를 차갑게 보관해줘서 냄새도 안나고 좋더라구요!가격은 10만원대 초반이었고, 전기세도 거의 안들어요! 아래는 구매 후 제가 적은 후기 글인데 쾌적하게 음식물 쓰레기 보관하시면 좋을 듯 합니다!(광고 아닙니다~!)', '안녕하세요.음식물쓰레기 벌레가 생기는 문제로 문의 주셨는데요.여름철이 되면서 음쓰로 인한 악취나 초파리 등의 문제로 문의가 많습니다.별레가 안생기게 하려면,온도를 낮추거나 약품을 뿌리는 등의 방법이 있겠지만그렇다고 음쓰를 냉장고에 보관은 절대하지 말아야하고,약품은 한게가 있고, 인체에도 도움이 안됩니다.아쉽지만 바로바로 버리는 방법밖에는 없습니다.대안은 이런 이유로 음식물처리기 사용이 방법입니다만말씀처럼 가격이 비싸고,잘 구입하면 삶의 질이 올라가지만, 잘못 구입하면 경제적 손해 및 스트래스 엄청 받습니다.이유에 대해서는 아래 누차 정리하고 있습니다만도움이 되시길 바랍니다.여름철이 되면서 음식물쓰레기로 인한 악취나 초파리 등 불편함으로음식물처리기 구매 문의가 증가하고 있습니다.음식물처리기 잘 구입하면 삶의 질이 올라가지만,말 못 구입하면 경제적 손해 및 스트레스 받습니다.냄새, 소음, 필터관리, 매일처리 등의 건조방식이나배관막힘 소음, 환경오염원의 싱크대분쇄기 보다는오폐수 배출이 없는 친환경 미생물음식물처리기의 관심이 높습니다.미생물음식물처리기가 편리성에서 가장 좋습니다.이제는 미생물기기 중 더 좋은 제품을 찾는 노력이 필요합니다.미생물의 특성에 따라서 애지중지하는 미생물도 있고,생선뼈, 닭뼈, 된장찌게 국물도 바로 처리되는 미생물방식의 제품이 있습니다.구입 고민하신다면, 꼼꼼히 점검하세요.아래 내용 참조 바랍니다.가정용, 업소용 음식물처리기 장단점 분석 및 .. : 네이버블로그 (naver.com)가정용, 업소용 음식물처리기 장단점 분석 및 구입 요령은?안녕하세요. 음식물쓰레기를 버리는 방법은 지역에 따라서 RFID방식, 종량제봉투방식, 칩(스티커)방식,...blog.naver.com']"
166,2024-09-06,음식물 쓰레기 분류 질문 입니다.,"1.중국집에서 짬뽕을 시키면 홍합이 오잖아요? 이거 홍합 껍질은 음식물 쓰레기에 분류 하는건가요?  2.과일 껍질 바나나 껍질, 사과 껍질도 음식물 쓰레기에 분류인거죠?","['1. 조개껍질 등은 음식물 쓰레기 아님2. 과일껍질은 음식물 쓰레기* 쉽게 생각해  쓰레기(잔반)을 돼지가 먹을 수 있으면 음식물쓰레기,  아니면 일반쓰레기', '안녕하세요.홍합 껍질은 일반 쓰레기로 분류하시면 되며, 과일 껍질은 음식물 쓰레기로 분류 하시면 됩니다 :)', '앞으로 발생되면 아래 사진을 참고하시고 분류하시면 되겠습니다 :)헷갈리는 것 중 음식물 쓰레기가 아닌 것들 입니다.', '안녕하세요.음식물쓰레기 잔존물 관련 질문 주셨는데요.홍합이나 조개껍질류는 일반쓰레기입니다.단단하지 않은 과일 껍질은 음식물쓰레기ㅣ로 버려야합니다.음식물쓰레기는 수거 후 자원화 즉, 사료화(아프리카 돼지열병으로 돼지는 사료 불가), 퇴비화, 연료화로 처리됩니다.이 과정중 영양가가 없거나, 처리 과정에서 단단한 물질등으로 문제요인은일반쓰레기입니다.간혹, 음식물쓰레기 처리기의 잔존물을 일반쓰레기라고 착각하는데,어느 지자체와 상관없이 폐기물관리법이나 실제 문제로건조된 음식물쓰레기 잔존물은 음식물쓰레기로 처리해야합니다.이유는일반쓰레기와 음식물쓰레기 처리 과정을 이해하시면 좋습니다.일반쓰레기는 수거 후 매립이나, 소각 처리됩니다.음쓰는 수거 후 사료나 퇴비, 애너지화로 처리됩니다.음쓰를 일쓰에 버리면 자원화에도 어렵고,건조된 음쓰는 물이 묻으면 매립시 토양오염원이고,소각시 염분에의한 다이옥신이 추가 발생합니다.음식물처리기 방식 중오폐수 배출이 없는 미생물방식의 제품이 있습니다.미생물방식의 잔존물은 일반쓰레기로 버려도 됩니다.자원화에는 아쉽지만퇴비 성적서를 받은 잔존물은 매립시 오염이 않되고,소각시에도 염분 분해로 문제 발생이 줄어듭니다.지자체마다 다르다는 애매한 이야기는,업체의 유언비어로지자체에서 조례로 법을 변경하는 경우인데,폐기물관리법의 상위법 문제로, 변경한 곳도 없고, 어렵습니다도움이 되시길 바라며,수시로 답변드리고 있습니다만여름철이 되면서 음식물쓰레기로 인한 악취나 초파리 등 불편함으로음식물처리기 구매 문의가 증가하고 있습니다.음식물처리기 잘 구입하면 삶의 질이 올라가지만,말 못 구입하면 경제적 손해 및 스트레스 받습니다.냄새, 소음, 필터관리, 매일처리 등의 건조방식이나배관막힘 소음, 환경오염원의 싱크대분쇄기 보다는오폐수 배출이 없는 친환경 미생물음식물처리기의 관심이 높습니다.미생물음식물처리기가 편리성에서 가장 좋습니다.이제는 미생물기기 중 더 좋은 제품을 찾는 노력이 필요합니다.미생물의 특성에 따라서 애지중지하는 미생물도 있고,생선뼈, 닭뼈, 된장찌게 국물도 바로 처리되는 미생물방식의 제품이 있습니다.구입 고민하신다면, 꼼꼼히 점검하세요.자세한 내용은 아래 블로그 참조 바랍니다.가정용, 업소용 음식물처리기 장단점 분석 및 .. : 네이버블로그 (naver.com)가정용, 업소용 음식물처리기 장단점 분석 및 구입 요령은?안녕하세요. 음식물쓰레기를 버리는 방법은 지역에 따라서 RFID방식, 종량제봉투방식, 칩(스티커)방식,...blog.naver.com']"
167,2024-08-01,내포신도시 음식물건조분쇄기 처리질문드립니다.,미닉스 음식물처리기입니다. 건조분쇄기 방식이구요. 갈고 버릴때지자체마다 일반쓰레기로 분류인지 음식물쓰레기 분류인지 다르다고하는데요 내포신도시는 둘중에 어느건가요?,"['안녕하세요.건조방식 음식물쓰레기처리기 잔존물 관련 질문 주셨는데요.폐기물관리법이나 실제 문제로건조된 음식물쓰레기 잔존물은 음식물쓰레기로 처리해야합니다.이유는일반쓰레기와 음식물쓰레기 처리 과정을 이해하시면 좋습니다.일반쓰레기는 수거 후 매립이나, 소각 처리됩니다.음쓰는 수거 후 사료나 퇴비, 애너지화로 처리됩니다.음쓰를 일쓰에 버리면 자원화에도 어렵고,건조된 음쓰는 물이 묻으면 매립시 토양오염원이고,소각시 염분에의한 다이옥신이 추가 발생합니다.음식물처리기 방식 중오폐수 배출이 없는 미생물방식의 제품이 있습니다.미생물방식의 잔존물은 일반쓰레기로 버려도 됩니다.자원화에는 아쉽지만퇴비 성적서를 받은 잔존물은 매립시 오염이 않되고,소각시에도 염분 분해로 문제 발생이 줄어듭니다.지자체마다 다르다는 애매한 이야기는,업체의 유언비어로지자체에서 조례로 법을 변경하는 경우인데,폐기물관리법의 상위법 문제로, 변경한 곳도 없고, 어렵습니다도움이 되시길 바라며,여름철이 되면서 음식물쓰레기로 인한 악취나 초파리 등 불편함으로음식물처리기 구매 문의가 증가하고 있습니다.음식물처리기 잘 구입하면 삶의 질이 올라가지만,말 못 구입하면 경제적 손해 및 스트레스 받습니다.냄새, 소음, 필터관리, 매일처리 등의 건조방식이나배관막힘 소음, 환경오염원의 싱크대분쇄기 보다는오폐수 배출이 없는 친환경 미생물음식물처리기의 관심이 높습니다.미생물음식물처리기가 편리성에서 가장 좋습니다.이제는 미생물기기 중 더 좋은 제품을 찾는 노력이 필요합니다.미생물의 특성에 따라서 애지중지하는 미생물도 있고,생선뼈, 닭뼈, 된장찌게 국물도 바로 처리되는 미생물방식의 제품이 있습니다.구입 고민하신다면, 꼼꼼히 점검하세요.아래 내용 참조 바랍니다.가정용, 업소용 음식물처리기 장단점 분석 및 .. : 네이버블로그 (naver.com)가정용, 업소용 음식물처리기 장단점 분석 및 구입 요령은?안녕하세요. 음식물쓰레기를 버리는 방법은 지역에 따라서 RFID방식, 종량제봉투방식, 칩(스티커)방식,...blog.naver.com']"
168,2024-04-08,음식물 분쇄기 질문이요!,"안녕하세요 음식물 분쇄기 사용해도 괜찮을까요? 사용하면 위법이라고해서 안전할지 궁금해요  음식물 분쇄기 불법이라고 쓰지말라고하더라구요 그래서 제가 정말 궁금해서 지식인에 질문드렸어요. 다른것도 찾아봤는데 음식물 분쇄기가 마음에 들었는데요, 집에 설치하려는데 불법이라고해서 마음에 걸리네요 ㅠㅠ  그래서 미생물 음식물처리기도 고민하고있는데요 음식물분쇄기중 합법적으로 설치할수있는게 있나요?  고민하고있는데  싱크퓨어 (분쇄형) vs 웰싱 (미생물형)","[""안녕하세요.음식물처리기 전문가 '음쓰왕'입니다.음식물 분쇄기 불법인지 궁금하신 상황이시군요.결론부터 말씀드립니다.불법인게 있고, 합법인게 있습니다.다만, 합법으로 싱크대 음식물 분쇄기를 사용하면 남은 찌꺼기의 80%를 소비자가 직접 걸러줘야 하기 때문에 사용하니만 못합니다.대부분의 전문가들의 의견은 동일할텐데, 저 역시 '굳이 불법 위험을 감수하고까지 구매할 필요가 없다'는 말씀을 드리고 싶습니다.왜냐하면 언급하신 미생물 음식물처리기도 분쇄형 못지 않게 기능이 좋아졌기 때문입니다.남겨주신 웰싱 제품은 대표가 직접 운영하는 블로그가 있습니다. 접속해서 내용을 보시면 궁금해하시는 내용이 모두 나와 있습니다.▼ 음식물처리기 이미 산 사람? 절대 클릭 금지 ▼질문자님의 고민에 도움이 되었길 바라며,혹시 풀리지 않은 궁금증이 있으시다면 댓글로 언제든 남겨주시길 바랍니다. ""]"
169,2023-05-22,스마트카라 음식물처리기 어떤가요?,날이 더워지니까 싱크대에 악취와 벌레들이 조금 보이더라구요 그래서 음식물쓰레기 처리를 어떻게 해야되나 고민하고 있었는데 현빈이 광고하는 스마트카라가 눈에 띄더라구요  그래서 스마트카라를 구매할까 고민하고 있는데  실제 사용하고 계시는 분들은 만족하시는지 궁금해요! 그리고 또 어떤 제품을 사용하시는지도요. 스마트카라에서도 다양한 제품이 있더라구요 저흰 4인가족에 음쓰가 많이 나오는 편이라 어떤 제품을 사면 좋을지 추천 좀 해주세요,"['스마트카라 구매하실려고 알아보시는군요?저는 작년부터 스마트카라를 사용하고 있는데 진짜 만족합니다저도 음식물처리기 사기 전에 많이 찾아봤었는데요저 같은 경우에는 수분을 제대로 없애줄 수 있는지,부피는 얼마나 줄여 줄수 있는지를 따져서 구매했어요!사실 음식물쓰레기에 벌레나 악취가 많이 나는 이유가 다 수분 때문에 생기는거라이걸 얼마나 잘 처리해주는 기술이 있느냐가 중요하거든요여러 제품을 비교했는데 스마트카라는 수분제로기술 통해서 최대 99%정도까지 수분량을 없애주더라구요.부피도 최대 95%까지 줄여줘서 요 제품으로 구매했습니다저희도 4인 가족인데 400 Pro도 충분하게 사용하고 있습니다.2L가 사이즈도 콤팩트한게 주방에 두고 쓰기 좋더라고요제품 후기도 진짜 좋은 애니까 사기 전에 한 번 참고해보세요만족도가 높은 제품으로 사셨으면 좋겠네요https://www.smartcara.com/product/detail.html?product_no=63', ""질문자님 안녕하세요?문의하신 질문 답변입니다.스마트 카라음식물 처리기 알아보고 계시는군요.미생물로 처리되는 음식물 처리기도한번 알아보세요.매일매일 쌓이는 음식물 쓰레기!악취에서 해방될 수 있는단 25초의 쉽고 빠른 음식물처리로우리집을 깨끗하고 안전하게 믿을 수있는 싱크케어로 하세요.'누구도 따라올 수 없는 독보적인 기술력환경부 공식 판매 인증 및 디자인 특허 제품'이예요.-지금까지 경험하지 못한 극상의 편리함-뚜껑형으로 그 무엇보다 안전하게-수면에 거의 영향을 주지 않는 30DB이하 저소음 싱크케어-스마트인식시스템으로 문제가 있으면 음성안내까지-천연 미생물로 분해 하여 100% 액체로 배출-단 25초! 넣고! 닫고! 끝!-장시간 집을 비워도 자동외출모드로 전환-15년의 노하우로 특허권 10종 및 각종 인증서 14종!허머의 기술력과 현대렌탈의 케어시스템이 만나독보적인 기술력과 독보적인 케어! 저렴한 비용으로 음식물처리기도 렌탈 시대을 만들어요.현대렌탈케어 프리미엄 케어서비스1. 현대렌탈케어 전문 엔지니어가 직접 방문하여 하이브리드 싱크케어 제품을 직접 설치2. 업체 최초로 프리미엄 안심관리 서비스- 배수 배관 교체서비스(24개월 주기)- 소모품 비대면 택배 배송 서비스 (12개월 주기)우리집의 환경지키미 꼭 이용해 보세요.https://me2.kr/cZWeV답변의 내용이 도움이 되셨길 바라며,행복하고 좋은 날만 있길바래요.감사합니다.""]"
