,질문 날짜,질문,내용,답변
91,2022-02-09,단독주택용 음식물스티커...,단독주택용 음식물스티커 아파트에서 써도 되나요?,"['음식물쓰레기 버리는 법 질문주셨는데요.음쓰를 버리는 방법은 RFID방식, 종량제 봉투방식, 칩방식, 스티커 방식, 위탁처리 방식등 다양합니다.모두 버린 만큼 요금을 부과하는 종량제 방식입니다.같은 지자체내에서는 우선 가능합니다만아파트는 단독 주택과 다르게 스티커 사용을 하지않고RFID나 종량제봉투 방식을 많이 사용합니다.아파트 사용 방법을 먼저 확인해보세요.도움이 되시길,,,출처 WWW.OKLIN.CO.KR음식물처리기 다짠다 & 오클린 한국전자유통음식물처리기,업소용음식물처리기,미생물음식물처리기,오클린,다짠다,한국전자유통,음식물분쇄기,음식물쓰레기처리기,가정용음식물처리기,음식물쓰레기,음식물쓰레기통,한국전자유통,한국전자유통&컨설팅,다짠다,오클린,다짠다&오클린,한일기계,컴포드,제인컴포드,오클린바이오,스마트카라,음식물건조기,루펜,린클,음식물건조기,음식물처리기렌탈,음식물탈수기,미생물음식물처리기,웰릭스,추천,렌탈,잔반처리기,식당음식물쓰레기,크리미크몬WWW.OKLIN.CO.KR', '같은지역이라면  가능하지만아파트의 경우 RFID종량기 사용으로음식물종량제 봉투를 사용하지 않는곳이라면사용을 할수 없을수도 있어요 ~단독,빌라는 보통 종량제봉투를 사용하거나수거용기에 스티커 부착해서 사용 하지만아파트에서는 RFID종량기 사용하는곳이  많아요.', '안녕하세요 (주)멈스입니다. 저희 멈스는 국내 음식물 쓰레기 처리 업체 중 미생물을 연구,생산하는 유일한 업체입니다.-음식물 쓰레기 처리기 도입시 고려사항1. 분쇄,압축,탈수,건조 등의 방식이 아닌 미생물 소멸방식인지 체크(분쇄,압축,탈수,건조방식은 하수구로 내려보내면 불법)(폐기물관리법 시행규칙 10조4항에 의거하여 하수구로 배출되는 배출고형물이 20% 이내이면 합법) 2. esg부분에대해 기여할수 있는지?(멈스는 미생물 발효 방식중 유일하게 미생물을 직접 연구 생산 합니다. 특허만 31개를 보유하고 있는 멈스 기술력은 발효시키고 나오는 배출수를 논,밭,꽃,나무에도 물을 줄수있을정도로 친환경적입니다.)(esg부분의 기여 관련 시험성적서 및 아시아로하스 인증 6년째 보유)  3. 철거및 법적으로 문제 되지않기 위한 하수처리장 방류수 기준인 bod, cod, ss, 대장균 등의 수치가 안정적인지?(위와 관련된 모든 수치는 저희의 기술력으로인해 0.3~1 사이로 수치가 나오게 되어 개인하수처리장등에서의 사용도 오히려 수치에 도움을 주게 됩니다.) 4. 대기업및 관공서 등 과 진행중인지?(저희 멈스는 수많은 대기업과 호텔 등과 MOU 협약을 맺어 다수의 대기업과 계약을 진행중입니다.)  5. 비용을 어느정도 줄여주는지?(매년 평균 약 5~10%씩 음식물처리 위탁비용이 증가하고 있습니다. 저희제품을 사용하였을시 평균 60%이상 절감을 하며 기계값을 제외하면 99%비용절감이 이루어집니다.) 6. 무료체험 및 as부분(저희는 현재 프로모션으로 무료체험을 진행하고 있으며, A/S는 24시간 이내 처리하여 드립니다.추가 비용 발생 없이 기존 위탁업체에 납부 하시는 금액 그대로 렌탈이 가능합니다. 감사합니다. ']"
92,2024-08-15,음식물 처리기 보조금 질문,안녕하세요 천안시 음식물 처리기 보조금이 나오나요? 신청은 어떻게 하나요? (참고로 저희집은 보조금 신청이 가능한 제품입니다.),"['아쉽게도 아직 천안시에서는 음식물 처리기 지원금이 지급되지 않는 듯 합니다.허나 추후 지원금을 지급할 수도 있는 상황이니 관심을 가지고 보시면 좋을 듯 합니다.음식물 처리기 보조금을 받기 위해서는 몇가지 조건이 필요합니다.1. K마크, 환경표지, 단체표준, Q마크 등 1개 이상의 인증 제품2. 미생물 발효처리 또는 건조 방식3. 하수도에 연결하여 배출하는 분쇄방식 및 주방용 오물 분쇄기 제외4. 새제품이 아닌 중고 또는 렌탈 제품은 제외위의 조건에 부합할 경우 음식물 처리기 구매일 기준 30일 이내에 신청이 가능합니다.보다 자세한 내용 및 지역별 지원금 지급여부는 아래 글을 참고해주세요.', '안녕하세요.천안시 음식물처리기 지원금 관련 질문주셨는데요.지자체 음식물처리기 지원사업은 음식물쓰레기 수거 운반에 문제가 있는 지자체에서주로 시행되며, 예산을 잡아 선착순 진행하기 때문에 빠른 정보와 신청이 중요합니다.현제 많은 지자체에서 지원사업을 진행하고 있지만, 아직 천안시는 지원이 없습니다.또한 이미 구입한 제품은 원칙적으로 지원이 안됩니다.이유는 음식물처리기를 구입해서 음쓰를 줄이라는 의미인데,이미 구입한 제품은 의미가 사라집니다.지자체 지원사업 공고는아래 사이트에서 빠른 정보 공유되고 있습니다.음식물처리기 다짠다 & 오클린 한국전자유통 (oklin.co.kr)음식물처리기 다짠다 & 오클린 한국전자유통음식물처리기,업소용음식물처리기,미생물음식물처리기,오클린,다짠다,한국전자유통,음식물분쇄기,음식물쓰레기처리기,가정용음식물처리기,음식물쓰레기,음식물쓰레기통,한국전자유통,한국전자유통&컨설팅,다짠다,오클린,다짠다&오클린,한일기계,컴포드,제인컴포드,오클린바이오,스마트카라,음식물건조기,루펜,린클,음식물건조기,음식물처리기렌탈,음식물탈수기,미생물음식물처리기,웰릭스,추천,렌탈,잔반처리기,식당음식물쓰레기,크리미크몬www.oklin.co.kr도움이 되시길 바라며,,,참고로, 음식물쓰레기로 인한 비용과 악취, 초파리 등 오염을 줄이고자 가정뿐만 아니라 업소나 식당등에서도 자가 처리하기 위한 음식물처리기 사용이 증가하고 있습니다 하지만,음식물처리기를 대부분은 대충 광고나 가격, 디자인 보고 구매하시는데,이런 경우 80% 이상 구매에 불만족입니다.그 결과는 중고마켓에 몇번 사용해보고 불편, 불만으로 반값에 쏟아져 나오는 제품이 많습니다.이유는 처리 방식 및 음식물처리기 노하우를 모르시기 때문입니다.다른 냉장고나 세탁기 처럼 고르면 실패 확율이 높은 제품이 음식물처리기 입니다.이런 이유로 수시로 답변드리고 있습니다만구입 요령은 아래 블로그에 자세히 기록하고 있습니다.우선,음식물처리기 처리 기술은 건조방식, 싱크대 분쇄방식, 미생물 방식 등 다양합니다.가장 구매 후 사용을 포기하는 건조방식은매일쓰레기를 모았다가, 밤새돌리고, 매일 잔존물을 처리해야합니다.이 과정은 사용해본사람만 불편함을 아실 수 있습니다.싱크대 분쇄 방식은 이제는 환경오염과 배관 막힘으로 포기 상태이구요.문제는 오폐수 배출이 없는 친환경 미생물 방식이 원리적으로 가장 좋은데,좋다고하니 다른 많은 회사에서 만들고 있지만기술력이 부족해 맵고 짠 한국 음식물에 미생물 관리를 해야하는 번거로움이 있습니다.하지만 27년 원조 회사의ㅣ 제품은 맵고 짠 한국음식물 특성에 강하여,된장찌게 국물이나 김치국물을 넣어도 죽지 않고 처리 가능합니다.생선뼈, 닭뼈도 처리 가능하며, 처리 용량도 우수하고,내부 통을 녹이 나지않는 서스를 하나하나 용접해서 만드는 최고급 우수 제품도 있습니다.도움이 되시길 바라며,아래 내용 참조 바랍니다.가정용, 업소용 음식물처리기 장단점 분석 및 .. : 네이버블로그 (naver.com)가정용, 업소용 음식물처리기 장단점 분석 및 구입 요령은?안녕하세요. 음식물쓰레기를 버리는 방법은 지역에 따라서 RFID방식, 종량제봉투방식, 칩(스티커)방식,...blog.naver.comhttps://blog.naver.com/etlandshin/223316084148음식물처리기 구입 요령 및 감량기 지원금 지지체 현황안녕하세요. 음식물쓰레기로 인한 악취 등 불편함과, 처리 비용 등 음식물처리기가 대안으로 구입이 증가하...blog.naver.com', '안녕하세요 음식물 처리기 보조금이 궁금하셨나봐요!!굳이 구매하시지 않아도 렌탈이용해서 사용해보실 수 있으니 구매 전 무료로 사용해보시는것도 좋을거같아요!!상담 받아보시고 무료체험으로 사용하시고 좋은 제품 구매하시길 바래요 ㅎㅎhttp://www.recaread.co.kr/MjI0MDY']"
93,2022-01-16,마포구에서 서대문구 음식물 쓰레기 봉지 사용해도 되나요?,배달 음식을 시켰다가 서대문구 음식물 쓰레기 봉지 하나를 서비스로 받게 되었는데요 저희 집은 마포구라서요 마포구에서 서대문구꺼 음식물 쓰레기 봉지를 써도 되는지 궁금합니다.!,"['원칙은 벗어나지만 위법은 아닙니다.음식물 쓰레기 종량제 봉툿값이 그 봉투에 넣은 음식물 수거 비용입니다.따라서 서대문의 봉툿값은 서대문 미화원의 몫인데 그것을 마포에서 쓰면 .....서대문은 보너스가 되지만 마포구는 무료 봉사가 되지요 ^^*....하지만  그 봉투를 유료 구입한 것은 님이기 때문에 님은 음식 쓰레기 배출에는 아무런 하자가 없지요.이러한 음식물 종량제 봉투는 집하장에서 일차 선별작업으로 다른 불순물과 함께 골라냅니다. 그래서 우수한 것은 가축사료로 만들고 나머지는 미생물 처리로 메탄올(바이오 에너지)을 생산하고찌꺼기(슬러시)는 가축 분과 섞어서 훌륭한 유기질 비료가 됩니다.따라서 음식물 쓰레기를 제대로 처리하면 100% 재활용을 할 수 있습니다.', '음식물쓰레기 봉투 관련 질문주셨는데요.음쓰를 버리는 방법은 RFID방식, 종량제 봉투방식, 칩방식, 스티커 방식, 위탁처리 방식등 다양합니다.모두 버린 만큼 요금을 부과하는 종량제 방식입니다.우선 타지역 봉투는 사용할 수 없습니다.사유는 음쓰를 처리하는 비용은 1kg 당 200~300원 정도 발생합니다.가정에서 버릴때 공공성이라서 서울시는배출자 비용은 130원입니다만이 비용마져 해당 구청은 손해라는 것입니다. 나머지 차액은 해당 지자체에서 부담합니다.타지역 종량제 봉투는, 정상적으로는 수거해가지 않을것입니다.심하면 불법투기로 과태료 대상이 될 수도 있습니다.도움이 되시길,,,출처 WWW.OKLIN.CO.KR음식물처리기 다짠다 & 오클린 한국전자유통음식물처리기,업소용음식물처리기,미생물음식물처리기,오클린,다짠다,한국전자유통,음식물분쇄기,음식물쓰레기처리기,가정용음식물처리기,음식물쓰레기,음식물쓰레기통,한국전자유통,한국전자유통&컨설팅,다짠다,오클린,다짠다&오클린,한일기계,컴포드,제인컴포드,오클린바이오,스마트카라,음식물건조기,루펜,린클,음식물건조기,음식물처리기렌탈,음식물탈수기,미생물음식물처리기,웰릭스,추천,렌탈,잔반처리기,식당음식물쓰레기,크리미크몬WWW.OKLIN.CO.KR', '마포구에서 마포구 쓰레기 봉투만 사용하셔야 합니다.마포구에서 서대문꺼 사용하시면 안됩니다.어느구에서 살면 그 구에꺼만 사용하셔야 합니다.']"
94,2022-01-24,음식물쓰레기 처리방법,대전에 사는 사람인데요 음식물 쓰레기를 봉투에 담아서 버리면 안 되나요? 투명 봉투요! 통 안에 봉투를 넣어서 버리는 거요!,"['네 음식물쓰레기 봉투에 담아버리는 것 안됩니다.', '일반 봉투에는 버리면 안되구요.음식물봉투에 담아 버리시거나음식물 수거함에 따로 버려야 합니다.음식물처리기 하나 장만하고 싶긴한데생각보다 종류가 많아서 고민이시죠?허머의 돋보적인 기술력과현대렌탈케어의 서비스의 싱크케어를 추천드려요!환경부 공식 판매 인증과 디자인 특허 제품으로현재 현대홈쇼핑에서도 방송되고 있고현대렌탈케어 전문 엔지니어가 직접 방문하여 설치는 물론업계 최초로 배수 배관 교체 서비스까지 받을 수 있어오래동안 안심하고 믿고 이용할 수 있어요!무료상담도 가능하니 함께 비교해보시면음식물처리기 선택하는데 도움 되실거예요!- 현대홈쇼핑 방송제품- 현대렌탈케어의 프리미엄 설치 서비스- 전국 59개 지국/사무소 운영- 업체 최초 프미리엄 케어서비스- 제휴카드 최대 할인시 월 6,900원- 렌탈 설치시 프로모션 혜택- 안정성, 친환경, 편의성 모두 갖춘- 하이브리드 싱크케어 음식물처리기- 뚜껑형으로 3점 자동센서로 안전하게- 넣고 닫고 25초면 끝- 저소음으로 조용하게- 강력한 2중 믹서 분쇄- 초강력 BLDC모터- S트랩 구조로 악취,세균,벌레 NO- 천연 미생물로 물과 이산화탄소로 분해- 15년 노하우- 환경부 인증 및 특허 취득- 이미 수 많은 고객들의 100%만족 후기홈페이지 바로가기 ▶ http://m.site.naver.com/0PYMG', '이미 수 많은 고객들의 100만족 후기환경부 인증 및 특허 취득넣고 닫고 25초면 끝', '음식물 쓰레기를 담은 투명 봉투를 사용하여 버리는 것은 일반적으로 안전하지 않습니다. 음식물 쓰레기는 자연 분해되기 어려워 산소가 부족한 환경에서 더욱 더 느리게 분해될 수 있습니다. 따라서, 음식물 쓰레기는 주로 재활용 가능한 음식물 쓰레기 처리기로 처리하거나 분해되는 환경에서 처리해야 합니다.일부 지역에서는 음식물 쓰레기 처리 설비가 없을 수도 있으므로, 관할 담당기관이 권고하는 방법을 따라야 합니다. 이 경우에는 음식물 쓰레기를 일회용 플라스틱 봉투 대신 재생지로 만들어진 종량제 쓰레기 봉투에 담아서 배출하는 것이 좋습니다. 이렇게하면 쓰레기가 부패하거나 악취를 방지하면서도 봉투가 재활용될 수 있습니다. 주민들은 지자체의 분리배출 규정을 확인하여 올바른 방법으로 음식물 쓰레기를 처리할 수 있도록해야 합니다.', '대전 지역에서는 음식물 쓰레기를 투명 봉투에 담아서 버리는 것이 권장되지 않습니다. 대전은 음식물 쓰레기를 가공하여 재활용하기 위해 식품회사와 협약한 ""음식물 쓰레기 혼합 액비용 처리사업""을 실시하고 있습니다. 이에 따라 음식물 쓰레기는 별도의 통에 담아서 버려야 합니다. 따라서 투명 봉투에 음식물 쓰레기를 담아서 버리는 것은 올바른 방법이 아닙니다. 음식물 쓰레기를 통에 담아서 버리는 것을 지속적으로 실천해 주시기 바랍니다.']"
95,2023-07-10,이미 생긴 초파리알 제거방법,음쓰통에 초파리알이 겁나 많이 붙어있는데 처리방법좀 알려주세요 변기에 버리나요 쓰레기통에 버리나요 어떻게 하나요 초파리 예방방법말고 이미 생긴거 처리 하는 방법이요ㅜㅜㅜㅜ,"['화장실에서 뜨거운물 몇번 쏜다음 행궈 내시면 됩니다.뜨거운물에 닿으면 대부분 다죽습니다.화장실 배수구에 그냥 버리셔도 되고요.변기에 버리셔도 됩니다.', '뜨거운물로 씻으세요', '안녕하세요??이미 생긴 초파리는 음쓰봉에 넣어서버리셔야 될거 같습니다.추가적으로 정보 하나 알려드려도 될까요?초파리는 음식물에서 가장 많이 나오는데요음식물 처리기를 렌탈로 사용하셔도 좋을실거 같습니다.음식물 처리기는 분쇄용 처리기,가정용 음식물 처리기 두가지가 있는데요친환경 미생물 담체를 이용한분쇄/ 분리 / 분해 소멸이 되는지를정확히 알아보셔야 합니다.저도 이번에 가정용 음식물 처리기를 설치하고 렌탈로 사용중인데요음식물 악취없고, 벌레가 꼬이지 않아서 너무나도 좋답니다.^~^친환경 미생물 음식물 처리기 장점- 분쇄/ 분리/ 분해 소멸 시스템- 환경부에 인증이 14종 취득- 뚜껑형으로 넣고! 닫고! 하면 끝- 천연 미생물로 분해 - 100% 액체로 배출- 밤에도 소음이 30DB 이하- 문제가 생길시 음성 안내- 장시간 집을 비워도 자동 외출모드 전환- 24개월에 한번씩 배수 배관 교체- 소모품 (미생물)도 12개월 주기로 택배 배송 서비스→ 간편상담 : https://me2.kr/oIQYV정수기 렌탈하는 것처럼 음식물 처리기도렌탈 서비스에요^^ 친환경 미생물로 처리해준다고 하니까한번 알아보시면  좋으실거 같습니다.질문에 답변이 되셨기를 바라며오늘도 좋은하루 되세요.감사합니다^^']"
99,2022-01-14,김해시 음식물쓰레기 어떻게 처리하나요?,"안녕하세요 이번에 첫자취를 하면서 음쓰를 직접 처리하게 됐는데 잘 모르겠어서 질문 올립니다.  1. 음쓰수거용기가 따로 있던데 그걸 사용하나요? 혹 그거 말고 음식물쓰레기 봉지에 넣어 배출 할 수는 없나요?  2. 전용수거용기를 사용해야한다면 수거용기와 칩, 스티커 모두 별도구매 해야하나요? 예전엔 칩을 사용했다는데 스티커로 바뀌었다는 말도 있고.. 수거용기에 칩과 스티커 모두 부착 해야하는지, 스티커만 부착하면 되는지 알려주세요!","['집에서 나오는 음식물쓰레기매일 쓰레기봉투에 모아서 버리는 것은 번거로운 일이죠지독한 냄새와 자꾸만 꼬이는벌레는 집 안에서도 밖에서도고민거리가 아닐 수 없습니다요즘은 코시국의 여파로 외식보다는 집에서 식사하는 분들이늘어나감에 따라서 더욱 음식물처리기에 대한 필요성이 늘었죠기왕 음식물쓰레기 버리시는거안전성, 친환경, 편의성 두루갖춘제품으로 해결하시길 바랍니다▣미생물 음식물처리기 장점▣1) 마개 닫아야 작동됨(안정성)> 3점 자동센서 적용, 오작동 방지2) 천연 미생물로 물+이산화탄소 분해(100% 액체로 깨끗하게)> 강력한 2중 믹서분쇄> 초강력 BLDC 모터> S트랩 구조로 악취, 세균, 벌레NO3) 29dB로 수면에 영향 거의 없이(저소음으로 조용하게)(나뭇잎 부딪히는 소리보다 조금 큰)4) 넣고 닫고 25면 끝(쉽고 빠르고 편리)5) 스마트 가자인식시스템(음성으로 스마트하게)6) 자동외출모드 : 장시간 집 비울떄(자동으로 걱정없게)7) 양방향 블렌더 팬으로 미생물이쾌적한 환경을 조성▣렌탈시 혜택▣1) 현대렌탈케어의 프리미엄 설치> 전국 59개 지국/사무소운영> 전문엔지니어가 방문2) 업계 최초 프리미엄 케어 서비스: 전문 케어 매니저가 1년 주기 방문> 배수, 배관 교체 서비스(24개월 주기)> 냄새 역류 및 배관 막힘 방지: 살균 서비스(12개월 주기)> 살균수를 투입하여 찌꺼기가남아있는 싱크대 홀과 배수관살균 / 세척: 전소모품 방문 교체 서비스(12개월)> 미생물 / 거름망 교체> 1년간 사용, 오렴된 거름망과친환경 미생물을 교체3) 제휴카드 안내: 월 2만원 할인 혜택> 렌탈 신청시 월 33,900원> 48개월 약정> 제휴카드 이용시 실적따라33,900원에서 차감되어 혜택▣음식물쓰레기 구분> 채소류 : 쪽파, 대파, 미나리 등 (뿌리), 고추씨, 고추대, 양파, 마늘,생강, 옥수수 등 (껍질), 옥수수대> 과일류 : 호두, 밤, 땅콩, 도토리 등(딱딱한 껍데기), 복숭아 ,살구, 감등 핵과류 (씨)> 곡류 : 왕겨(벼의 겉겨)> 육류 : 소, 돼지, 닭 등 털과 뼈다귀> 어패류 : 조개, 소라, 전복, 멍게, 굴 등의 (껍데기), 게, 가재 등(갑각류의 껍데기), 생선뼈> 기타 : 계란 등 (알 껍데기),각종 차류의 (찌꺼기), 한약재 찌꺼기아래 본사제공 홈페이지를 통해더 자세한 상담 받아보세요!▣음식물처리기 상담받아보기https://vo.la/xWGa0']"
100,2022-06-29,웰싱음식물처리기..,아침에 빵한조각넣고 점심때쯤 다른음쓰넣으려고보니 아침에넣은빵이 그대로그자리에있어요 회전봉이 안도는거같아요 미생물이 죽은건가싶어 다 퍼내봤는데 그래도 회전봉은 돌지않아요..왜그런걸까요?,['기기 문제인것같습니다']
